{
  "id": "v01-clean-aggregate-001",
  "profile": "trust",
  "description": "v0.1 receipt (no per-action results): clean aggregate + verified-tier → ready.",
  "input": {
    "action": {
      "id": "act_001",
      "kind": "submit",
      "title": "参加確認票を提出する",
      "modality": "required",
      "actor": {
        "certainty": "unknown"
      },
      "temporal": {
        "type": "exact",
        "date": "2026-10-05",
        "raw_text": "10月5日まで"
      },
      "evidence": [
        {
          "source_id": "conf",
          "text": "10月5日までに提出してください。"
        }
      ],
      "inference": "explicit",
      "status": "verified"
    },
    "verification": {
      "evidence_supported": true,
      "temporal_supported": true,
      "actor_supported": true,
      "modality_supported": true,
      "source_hash_matched": true,
      "negation_conflict": false,
      "page_refs_valid": true,
      "passed": true
    }
  },
  "expected": {
    "ready": true,
    "reason": "READY",
    "disposition": "ready",
    "exportable_default": true
  }
}
