{
  "id": "exported-tier-001",
  "profile": "trust",
  "description": "exported is a verified-tier status → ready with passing receipt.",
  "input": {
    "action": {
      "id": "act_001",
      "kind": "submit",
      "title": "参加確認票を提出する",
      "modality": "required",
      "actor": {
        "certainty": "unknown"
      },
      "temporal": {
        "type": "exact",
        "date": "2026-10-05",
        "raw_text": "10月5日まで"
      },
      "evidence": [
        {
          "source_id": "conf",
          "text": "10月5日までに提出してください。"
        }
      ],
      "inference": "explicit",
      "status": "exported"
    },
    "verification": {
      "evidence_supported": true,
      "temporal_supported": true,
      "actor_supported": true,
      "modality_supported": true,
      "source_hash_matched": true,
      "negation_conflict": false,
      "page_refs_valid": true,
      "passed": true,
      "actions": [
        {
          "action_id": "act_001",
          "passed": true,
          "evidence_supported": true,
          "temporal_supported": true,
          "actor_supported": true,
          "modality_supported": true,
          "negation_conflict": false,
          "page_refs_valid": true,
          "issues": []
        }
      ]
    }
  },
  "expected": {
    "ready": true,
    "reason": "READY",
    "disposition": "ready",
    "exportable_default": true
  }
}
