{
  "id": "fatal-hash-001",
  "profile": "trust",
  "description": "source hash mismatch is manifest-level fatal → blocked even when per-action checks pass.",
  "input": {
    "action": {
      "id": "act_001",
      "kind": "submit",
      "title": "参加確認票を提出する",
      "modality": "required",
      "actor": {
        "certainty": "unknown"
      },
      "temporal": {
        "type": "exact",
        "date": "2026-10-05",
        "raw_text": "10月5日まで"
      },
      "evidence": [
        {
          "source_id": "conf",
          "text": "10月5日までに提出してください。"
        }
      ],
      "inference": "explicit",
      "status": "verified"
    },
    "verification": {
      "evidence_supported": true,
      "temporal_supported": true,
      "actor_supported": true,
      "modality_supported": true,
      "source_hash_matched": false,
      "negation_conflict": false,
      "page_refs_valid": true,
      "passed": false,
      "actions": [
        {
          "action_id": "act_001",
          "passed": true,
          "evidence_supported": true,
          "temporal_supported": true,
          "actor_supported": true,
          "modality_supported": true,
          "negation_conflict": false,
          "page_refs_valid": true,
          "issues": []
        }
      ],
      "issues": [
        {
          "code": "SOURCE_HASH_MISMATCH",
          "message": "hash mismatch"
        }
      ]
    }
  },
  "expected": {
    "ready": false,
    "reason": "MANIFEST_FATAL",
    "disposition": "blocked",
    "exportable_default": false
  }
}
